 "HOME A table Ballerz Bible Club Couple time","Leader(s) Ellinor, Kenzie J-F Olivier, Sophie JJ, Béa","Description de la home (2 phrases max) Venez partager un dîner et un moment de convivialité, chacun apportant un plat, une entrée ou un dessert pour partager un repas autour de la table. Venez nous rejoindre pour un merveilleux moment de joie à table. Nous allons partager la foi et la pratique du basketball. Pour les 14 ans et plus Rejoins-nous pour parcourir ensemble la Bible et la laisser nous édifier.Cette Home est pour toi: passionné(e) de sa lecture ou encore toi qui as besoin de motivation ou de clés pour t’y (re)mettre et ensemble nous aurons (de nouveau) le goût de méditer la Parole de Dieu 😊 Se rassembler entre couples,
apprendre à s’investir dans sa
relation en plaçant Christ au centre
et apprendre les uns des autres.","Jour et Horaires un mercredi sur deux, 19h-21h Varie Vendredi, 19h30-21h30 Vendredi, 19h30-21h30","Fréquence 2 fois par mois 1 fois par mois 2 fois par mois 1 fois par mois","Date de la 1ere rencontre 11/03 ; 25/03 ; 08/04 ; 06/05 ; 20/05 ; 03/06 ; 17/06  ","Taille de teeshirt  L et S 4xl et 2xl","","","","","","","","","","","","","","","","","","",""
"Dance","Romane, Ruth","Viens apprendre à danser pour Dieu sur des styles urbains, dans un esprit de partage, de bienveillance et de joie, où technique, expression et cœur s’unissent pour Le glorifier.","Un lundi sur deux, 19h15-21h15","2 fois par mois","lundi 16 mars","XXL","","","","","","","","","","","","","","","","","","",""
"Drum'n'bass","Michael","Pour batteurs et bassistes du groupe worship ou non. Travailler des grooves et des arrangements basse/batterie ou seulement bosser la batterie, et pouvoir mettre en application durant les célébrations.  Le tout dans la bonne humeur, l'amusement, la créativité, sur des chants de styles variés !","Samedi matin 10h","1 fois par mois","14 mars","M","","","","","","","","","","","","","","","","","","",""
"English","Noel, Kevin","If you already speak English or are looking to grow in your English, join us for a time of reflecting in God's word and shared moments together in English ! This will be a low pressure environment, all levels welcome !","un lundi sur deux, 19h-21h","1 fois par mois","","","","","","","","","","","","","","","","","","","","",""
"Famille (Colomiers)","Lydie, Chris","Rejoins-nous pour un moment de rencontre en famille, convivial, avec joie et bonne humeur  du côté de colomiers. ","varie","1 fois par mois","","L et L ","","","","","","","","","","","","","","","","","","",""
"Famille (Grenade)","Laia, Samuel","Nous serons ravis de vous accueillir dans notre maison pour passer des moments de communion sous forme d'agapes en famille ! Exhortations, témoignages et plein d'autres choses encore !","dimanche après-midi ","1 fois par mois","","M et XL","","","","","","","","","","","","","","","","","","",""
"Famille (Tarabel)","Emma, Eliezer","Hello les familles ! Si vous avez à cœur de rencontrer, partager avec d’autres familles et vous en faire des amis, rdv à Tarabel, nôtre fief depuis 2 ans maintenant ! ","Vendredi, a partir de 19h30","1 fois par mois","","","","","","","","","","","","","","","","","","","","",""
"Figth Club","Marie Laeticia, Thi Thu, Magalie","Si tu as un coeur d'intercesseur, viens passer une soirée de prière à nos côtés. Nous prierons pour les sujets de prière déposés à l'église tout en se laissant guider par l'Esprit de Dieu","Un mardi soir sur deux, 19h-21h","2 fois par mois ","mardi 10/03/2026","","","","","","","","","","","","","","","","","","","",""
"First Step","Thibault, Audrey","Étude des fondements de la vie
chrétienne pour nouveaux chrétiens ou
personnes en cheminement vers Jésus.","Mardi 19h-21h","2 fois par mois","","L, L, XL","","","","","","","","","","","","","","","","","","",""
"Game Night","Lisa, Hugo, Ravaka, Eric","Un groupe pour partager un moment convivial, mêlant foi et jeux de société (les mauvais perdants sont les bienvenus !).","Vendredi 19h30","2 fois par mois","vendredi 20/3/2026","S, XL, S et S","","","","","","","","","","","","","","","","","","",""
"Gentlemen","Jeremie,  Samuel","Partager de bons moments, grandir ensemble
en tant que frères, se soutenir les uns les autres, avec Dieu au centre","
Un mercredi soir sur deux, 19h-21h","2 fois par mois","","","","","","","","","","","","","","","","","","","","",""
"Guitar Heros","Jeremie","Echange technique et pratique entre guitaristes, de l'équipe worship ou non, pour progresser ensemble.","Dimanche après-midi","1 fois par mois","","","","","","","","","","","","","","","","","","","","",""
"HOLY-G Home","Mathilde, Etienne, Max, Amandine","Holy-G Home, des rendez-vous entre jeunes pour parler de Dieu, partager nos vies, prier ensemble et grandir dans la foi. 
Simple, convivial et puissant. 
Un mercredi soir sur deux - à l'église
avec Etienne, Mathilde, Max et Amandine","Un mercredi soir sur deux","2 fois par mois","","S et L ","","","","","","","","","","","","","","","","","","",""
"Home Care","Nicole, Sylvie","Un parcours en 3 sessions pour cheminer face à nos blessures et parfois nos traumatismes, dans la bienveillance et la confidentialité. Il est important de  participer au parcours en entier pour bénéficier de ce cheminement.","3 samedis matin","","","","","","","","","","","","","","","","","","","","","",""
"Home Créa","Lola & Laurette","La Home créa est l'opportunité d'exprimer et d'explorer  ta créativité tout en glorifiant Dieu. Peinture,  couture, dessin... grand artiste ou amateur, il y a une place pour toi !  Entre  joie, rire et prière, venez passer des moments avec nous, un samedi par mois.","Samedi matin 10h ","1 fois par mois","21 mars","","","","","","","","","","","","","","","","","","","",""
"Home Leader","Manou","Tu es un leader, ou tu as à cœur de le devenir ? Veux-tu aider à faire grandir les autres dans leur don ?
La Home Leader est faite pour toi.
Ensemble, nous explorerons les fondements d’un bon leader ainsi que les outils pour le devenir.","Un mardi soir sur deux, 19h-21h","2 fois par mois","","","","","","","","","","","","","","","","","","","","",""
"Home Mom's","Nesrine","Que tu sois une maman parfaite ou imparfaite, nous t'accueillons pour des temps de partages, de rires, d'encouragements et de prières pour toi mais aussi pour tes enfants. 
Alors inscris-toi sans attendre à la HOME MOM'S ","Mercredi soir ","2 fois par mois","","","","","","","","","","","","","","","","","","","","",""
"Home Photo","Laura Debenest","Tu aimes la photo tu as envie d'aller un peu plus loin ? On va se challenger, tester des techniques, revoir les bases et surtout s'amuser autour de l'univers créatif de la photo !","Samedi après-midi","1 fois par mois","samedi 14 mars 2026","","","","","","","","","","","","","","","","","","","",""
"Kingdom Entrepreneurs","Guillaume","Un groupe destiné aux entrepreneurs et porteurs de projets souhaitant concilier business et foi. Il se réunit pour échanger sur des sujets mêlant entrepreneuriat et valeurs chrétiennes et s'encourager mutuellement à bâtir des entreprises ancrées dans le Royaume de Dieu.","Un mardi soir sur deux, 19h-21h","2 fois par mois","","M","","","","","","","","","","","","","","","","","","",""
"Ladies","Ketsia, Magalie","n espace de confiance 100 % féminin avec Christ au centre pour se livrer, se soutenir, passer des moments conviviaux afin de devenir des femmes épanouies et enracinées dans la foi.","Samedi","","","","","","","","","","","","","","","","","","","","","",""
"Mari & Daddy","Olivier, J-F","Un groupe pour les maris et les papas (les fiancés sont les bienvenus), pour chercher ensemble la direction de Dieu pour nos vies, regarder des exemples d'hommes de la bible et pour partager nos vécus. ","Vendredi soir","2 fois par mois","","M et M","","","","","","","","","","","","","","","","","","",""
"Salt & Light","Laure, Ornella","Un groupe pour aller briller dans les rues de Toulouse ! Nous allons jongler entre des temps d'intercession, des marches de prières dans la ville et des sorties d'Evangélisation créatives.","Essentiellement les mardis","3 fois par mois","","S et XS","","","","","","","","","","","","","","","","","","",""
"Social Club","Maude & Justin","Célibataire, séparé(e), divorcé(e) ?
Bienvenue au Social Club : une sortie une fois par mois, alliant fun et temps de qualité, partage et prière.
Rejoins-nous !","Samedi apres-midi ","1 fois par mois","","","","","","","","","","","","","","","","","","","","",""
"Teenz","Laura, Boris, Thi Thu","Se rassembler entre ados de 11 à 17 ans pour connaître Jésus, développer une relation avec Lui et entre nous.","Le samedi de 18h à 20h","1 fois par mois","","L et M (Thi Thu S)","","","","","","","","","","","","","","","","","","",""
"Théatre","Clémentine, Chloé","Timide ou non, nous voulons expérimenter la gloire de Dieu au travers du théâtre. Mouvements, sketchs, temps de prière et de discussion, viens partager ce moment avec nous et découvre toi dans l'art qu'est le théâtre !","Dimanche après-midi","1 fois par mois","","S et M","","","","","","","","","","","","","","","","","","",""
"Théo","Manou","Approfondir ensemble les écritures et y
découvrir encore plus le cœur de Dieu.","Vendredi soir","1 fois par mois","","","","","","","","","","","","","","","","","","","","",""
"Worship workshop","Emilie, Matthieu","Si tu fais déjà partie de LR Worshipteam, viens nous rejoindre un lundi soir par mois à l'église LR à 20h pour continuer à progresser ensemble dans l'apprentissage de certains chants et dans la construction des moments plus spontanés de louange.","Lundi soir, 20h","1 fois par mois","lundi 9 mars 2026","","","","","","","","","","","","","","","","","","","",""